<?xml version="1.0" encoding='UTF-8'?>
<!DOCTYPE catalog PUBLIC "-//Cail Lomecb//DTD Colorer CATALOG take5//EN"
  "http://colorer.sf.net/2003/catalog.dtd">

<catalog xmlns="http://colorer.sf.net/2003/catalog"
         xmlns:xsi="http://www.w3.org/2001/XMLSchema-instance"
         xsi:schemaLocation="http://colorer.sf.net/2003/catalog
                             http://colorer.sf.net/2003/catalog.xsd">

  <hrc-sets>
    <location link="hrc/proto.hrc"/>
    <location link="hrc/auto/ccsql.hrc"/>
    <location link="hrc/auto/farmanager.hrc"/>
    <location link="hrc/auto/gen.hrc"/>
    <location link="hrc/auto/litestep.hrc"/>
    <location link="hrc/auto/qrm.hrc"/>
    <location link="hrc/auto/rare-scripts.hrc"/>
    <location link="hrc/auto/vim.hrc"/>
  </hrc-sets>

  <hrd-sets>
    <hrd class="rgb" name="default" description="White (crimsoned)">
      <location link="hrd/rgb/white.hrd"/>
    </hrd>
    <hrd class="rgb" name="navy" description="Navy (seashore)">
      <location link="hrd/rgb/navy.hrd"/>
    </hrd>
    <hrd class="rgb" name="eclipse" description="A'la Eclipse (minimal)">
      <location link="hrd/rgb/eclipse.hrd"/>
    </hrd>
    <hrd class="rgb" name="neo" description="Neo (and Morpheus)">
      <location link="hrd/rgb/neo.hrd"/>
    </hrd>
    <hrd class="rgb" name="black"  description="Black (scarlet)">
      <location link="hrd/rgb/black.hrd"/>
    </hrd>
    <hrd class="rgb" name="grayscale" description="Grayscale (colour neutral)">
      <location link="hrd/rgb/grayscale.hrd"/>
    </hrd>
    <hrd class="rgb" name="fmx" description="FMX">
      <location link="hrd/rgb/contrib/fmx.hrd"/>
    </hrd>
    <hrd class="rgb" name="hs" description="A'la HomeSite">
      <location link="hrd/rgb/hs.hrd"/>
    </hrd>
    <hrd class="rgb" name="bred3" description="Bred3 colors">
      <location link="hrd/rgb/contrib/bred3.hrd"/>
    </hrd>
  </hrd-sets>

</catalog>